{
  "artifact_type": "unit_vocabulary@1",
  "units": [
    { "unit_id": "g", "symbol": "g", "dimension": [{ "base": "mass", "exponent": 1 }] },
    { "unit_id": "mg", "symbol": "mg", "dimension": [{ "base": "mass", "exponent": 1 }] },
    { "unit_id": "ug", "symbol": "µg", "dimension": [{ "base": "mass", "exponent": 1 }] },
    { "unit_id": "kg", "symbol": "kg", "dimension": [{ "base": "mass", "exponent": 1 }] },
    { "unit_id": "Da", "symbol": "Da", "dimension": [{ "base": "mass", "exponent": 1 }] },
    { "unit_id": "kDa", "symbol": "kDa", "dimension": [{ "base": "mass", "exponent": 1 }] },
    { "unit_id": "gDW", "symbol": "gDW", "dimension": [{ "base": "mass", "exponent": 1 }] },
    { "unit_id": "gWW", "symbol": "gWW", "dimension": [{ "base": "mass", "exponent": 1 }] },
    { "unit_id": "mol", "symbol": "mol", "dimension": [{ "base": "amount", "exponent": 1 }] },
    { "unit_id": "mmol", "symbol": "mmol", "dimension": [{ "base": "amount", "exponent": 1 }] },
    { "unit_id": "umol", "symbol": "µmol", "dimension": [{ "base": "amount", "exponent": 1 }] },
    { "unit_id": "nmol", "symbol": "nmol", "dimension": [{ "base": "amount", "exponent": 1 }] },
    { "unit_id": "mol_e", "symbol": "mol e⁻", "dimension": [{ "base": "charge", "exponent": 1 }] },
    { "unit_id": "L", "symbol": "L", "dimension": [{ "base": "length", "exponent": 3 }] },
    { "unit_id": "mL", "symbol": "mL", "dimension": [{ "base": "length", "exponent": 3 }] },
    { "unit_id": "uL", "symbol": "µL", "dimension": [{ "base": "length", "exponent": 3 }] },
    { "unit_id": "s", "symbol": "s", "dimension": [{ "base": "time", "exponent": 1 }] },
    { "unit_id": "min", "symbol": "min", "dimension": [{ "base": "time", "exponent": 1 }] },
    { "unit_id": "h", "symbol": "h", "dimension": [{ "base": "time", "exponent": 1 }] },
    { "unit_id": "d", "symbol": "d", "dimension": [{ "base": "time", "exponent": 1 }] },
    { "unit_id": "K", "symbol": "K", "dimension": [{ "base": "temperature", "exponent": 1 }] },
    { "unit_id": "degC", "symbol": "°C", "dimension": [{ "base": "temperature", "exponent": 1 }] },
    { "unit_id": "M", "symbol": "M", "dimension": [{ "base": "amount", "exponent": 1 }, { "base": "length", "exponent": -3 }] },
    { "unit_id": "mM", "symbol": "mM", "dimension": [{ "base": "amount", "exponent": 1 }, { "base": "length", "exponent": -3 }] },
    { "unit_id": "uM", "symbol": "µM", "dimension": [{ "base": "amount", "exponent": 1 }, { "base": "length", "exponent": -3 }] },
    { "unit_id": "nM", "symbol": "nM", "dimension": [{ "base": "amount", "exponent": 1 }, { "base": "length", "exponent": -3 }] },
    { "unit_id": "bp", "symbol": "bp", "dimension": [{ "base": "length", "exponent": 1 }] },
    { "unit_id": "kb", "symbol": "kb", "dimension": [{ "base": "length", "exponent": 1 }] },
    { "unit_id": "Mb", "symbol": "Mb", "dimension": [{ "base": "length", "exponent": 1 }] },
    { "unit_id": "nm", "symbol": "nm", "dimension": [{ "base": "length", "exponent": 1 }] },
    { "unit_id": "OD600", "symbol": "OD600", "dimension": [] },
    { "unit_id": "cell", "symbol": "cell", "dimension": [] },
    { "unit_id": "CFU", "symbol": "CFU", "dimension": [] },
    { "unit_id": "U", "symbol": "U", "dimension": [{ "base": "amount", "exponent": 1 }, { "base": "time", "exponent": -1 }] },
    { "unit_id": "umol_per_min", "symbol": "µmol/min", "dimension": [{ "base": "amount", "exponent": 1 }, { "base": "time", "exponent": -1 }] },
    { "unit_id": "kcat", "symbol": "s⁻¹", "dimension": [{ "base": "time", "exponent": -1 }] },
    { "unit_id": "mg_per_mL", "symbol": "mg/mL", "dimension": [{ "base": "mass", "exponent": 1 }, { "base": "length", "exponent": -3 }] },
    { "unit_id": "dimensionless", "symbol": "1", "dimension": [] },
    { "unit_id": "percent", "symbol": "%", "dimension": [] },
    { "unit_id": "ppm", "symbol": "ppm", "dimension": [] }
  ],
  "conversions": [
    { "from": "min", "to": "s", "factor": "60", "note": "SI 定义：1 min = 60 s（BIPM SI Brochure 9th ed., Table 6）" },
    { "from": "h", "to": "s", "factor": "3600", "note": "SI 定义：1 h = 3600 s（BIPM SI Brochure 9th ed., Table 6）" },
    { "from": "d", "to": "s", "factor": "86400", "note": "SI 定义：1 d = 86400 s（BIPM SI Brochure 9th ed., Table 6）" },
    { "from": "h", "to": "min", "factor": "60", "note": "SI 定义：1 h = 60 min（BIPM SI Brochure 9th ed., Table 6）" },
    { "from": "d", "to": "min", "factor": "1440", "note": "SI 定义：1 d = 24 h = 1440 min（BIPM SI Brochure 9th ed., Table 6）" },
    { "from": "d", "to": "h", "factor": "24", "note": "SI 定义：1 d = 24 h（BIPM SI Brochure 9th ed., Table 6）" },
    { "from": "mg", "to": "g", "factor": "0.001", "note": "SI 前缀：m = 10^-3（BIPM SI Brochure 9th ed., Table 3）" },
    { "from": "ug", "to": "mg", "factor": "0.001", "note": "SI 前缀：µ = 10^-6，1 µg = 10^-3 mg（BIPM SI Brochure 9th ed., Table 3）" },
    { "from": "ug", "to": "g", "factor": "0.000001", "note": "SI 前缀：1 µg = 10^-6 g（BIPM SI Brochure 9th ed., Table 3）" },
    { "from": "g", "to": "mg", "factor": "1000", "note": "SI 前缀逆换算：1 g = 10^3 mg（BIPM SI Brochure 9th ed., Table 3）" },
    { "from": "mg", "to": "ug", "factor": "1000", "note": "SI 前缀逆换算：1 mg = 10^3 µg（BIPM SI Brochure 9th ed., Table 3）" },
    { "from": "kg", "to": "g", "factor": "1000", "note": "SI 定义：1 kg = 10^3 g（BIPM SI Brochure 9th ed.）" },
    { "from": "g", "to": "kg", "factor": "0.001", "note": "SI 定义：1 g = 10^-3 kg（BIPM SI Brochure 9th ed.）" },
    { "from": "mg", "to": "kg", "factor": "0.000001", "note": "SI 前缀链：1 mg = 10^-6 kg（BIPM SI Brochure 9th ed., Table 3）" },
    { "from": "ug", "to": "kg", "factor": "0.000000001", "note": "SI 前缀链：1 µg = 10^-9 kg（BIPM SI Brochure 9th ed., Table 3）" },
    { "from": "Da", "to": "g", "factor": "0.0000000000000000000000016605390666", "note": "CODATA 2018：原子质量常数 m_u = 1.66053906660e-27 kg，1 Da = 1.6605390666e-24 g" },
    { "from": "kDa", "to": "Da", "factor": "1000", "note": "SI 前缀：k = 10^3，1 kDa = 10^3 Da（BIPM SI Brochure 9th ed., Table 3；质量规格领域惯例）" },
    { "from": "kDa", "to": "g", "factor": "0.0000000000000000000016605390666", "note": "CODATA 2018 链式：1 kDa = 10^3 Da = 1.6605390666e-21 g" },
    { "from": "mmol", "to": "mol", "factor": "0.001", "note": "SI 前缀：m = 10^-3（BIPM SI Brochure 9th ed., Table 3）" },
    { "from": "umol", "to": "mmol", "factor": "0.001", "note": "SI 前缀：1 µmol = 10^-3 mmol（BIPM SI Brochure 9th ed., Table 3）" },
    { "from": "nmol", "to": "umol", "factor": "0.001", "note": "SI 前缀：1 nmol = 10^-3 µmol（BIPM SI Brochure 9th ed., Table 3）" },
    { "from": "umol", "to": "mol", "factor": "0.000001", "note": "SI 前缀链：1 µmol = 10^-6 mol（BIPM SI Brochure 9th ed., Table 3）" },
    { "from": "nmol", "to": "mol", "factor": "0.000000001", "note": "SI 前缀链：1 nmol = 10^-9 mol（BIPM SI Brochure 9th ed., Table 3）" },
    { "from": "mol", "to": "mmol", "factor": "1000", "note": "SI 前缀逆换算：1 mol = 10^3 mmol（BIPM SI Brochure 9th ed., Table 3）" },
    { "from": "mmol", "to": "umol", "factor": "1000", "note": "SI 前缀逆换算：1 mmol = 10^3 µmol（BIPM SI Brochure 9th ed., Table 3）" },
    { "from": "umol", "to": "nmol", "factor": "1000", "note": "SI 前缀逆换算：1 µmol = 10^3 nmol（BIPM SI Brochure 9th ed., Table 3）" },
    { "from": "mL", "to": "L", "factor": "0.001", "note": "SI 前缀：mL = 10^-3 L（BIPM SI Brochure 9th ed., Table 3；UCUM: mL = 10^-3 L）" },
    { "from": "uL", "to": "mL", "factor": "0.001", "note": "SI 前缀：µL = 10^-3 mL（BIPM SI Brochure 9th ed., Table 3；UCUM: uL = 10^-3 mL）" },
    { "from": "uL", "to": "L", "factor": "0.000001", "note": "SI 前缀链：µL = 10^-6 L（BIPM SI Brochure 9th ed., Table 3）" },
    { "from": "L", "to": "mL", "factor": "1000", "note": "SI 前缀逆换算：1 L = 10^3 mL（BIPM SI Brochure 9th ed., Table 3）" },
    { "from": "mL", "to": "uL", "factor": "1000", "note": "SI 前缀逆换算：1 mL = 10^3 µL（BIPM SI Brochure 9th ed., Table 3）" },
    { "from": "L", "to": "uL", "factor": "1000000", "note": "SI 前缀链：1 L = 10^6 µL（BIPM SI Brochure 9th ed., Table 3）" },
    { "from": "mM", "to": "M", "factor": "0.001", "note": "SI 前缀：mM = 10^-3 M（BIPM SI Brochure 9th ed., Table 3；M = mol/L 定义）" },
    { "from": "uM", "to": "mM", "factor": "0.001", "note": "SI 前缀：µM = 10^-3 mM（BIPM SI Brochure 9th ed., Table 3）" },
    { "from": "nM", "to": "uM", "factor": "0.001", "note": "SI 前缀：nM = 10^-3 µM（BIPM SI Brochure 9th ed., Table 3）" },
    { "from": "uM", "to": "M", "factor": "0.000001", "note": "SI 前缀链：µM = 10^-6 M（BIPM SI Brochure 9th ed., Table 3）" },
    { "from": "nM", "to": "M", "factor": "0.000000001", "note": "SI 前缀链：nM = 10^-9 M（BIPM SI Brochure 9th ed., Table 3）" },
    { "from": "M", "to": "mM", "factor": "1000", "note": "SI 前缀逆换算：1 M = 10^3 mM（BIPM SI Brochure 9th ed., Table 3）" },
    { "from": "mM", "to": "uM", "factor": "1000", "note": "SI 前缀逆换算：1 mM = 10^3 µM（BIPM SI Brochure 9th ed., Table 3）" },
    { "from": "uM", "to": "nM", "factor": "1000", "note": "SI 前缀逆换算：1 µM = 10^3 nM（BIPM SI Brochure 9th ed., Table 3）" },
    { "from": "bp", "to": "kb", "factor": "0.001", "note": "领域惯例 + UCUM 前缀语义：kb = 10^3 bp（序列长度十进制前缀；非物理米制）" },
    { "from": "kb", "to": "Mb", "factor": "0.001", "note": "领域惯例 + UCUM 前缀语义：Mb = 10^3 kb（序列长度十进制前缀）" },
    { "from": "bp", "to": "Mb", "factor": "0.000001", "note": "领域惯例 + UCUM 前缀链：Mb = 10^6 bp（序列长度十进制前缀）" },
    { "from": "kb", "to": "bp", "factor": "1000", "note": "领域惯例 + UCUM 前缀逆换算：1 kb = 10^3 bp" },
    { "from": "Mb", "to": "kb", "factor": "1000", "note": "领域惯例 + UCUM 前缀逆换算：1 Mb = 10^3 kb" },
    { "from": "Mb", "to": "bp", "factor": "1000000", "note": "领域惯例 + UCUM 前缀逆换算：1 Mb = 10^6 bp" },
    { "from": "U", "to": "umol_per_min", "factor": "1", "note": "IUPAC 酶活定义：1 U = 1 µmol 底物转化/min（Nomenclature Committee of IUBMB；Bier 1955）" },
    { "from": "percent", "to": "dimensionless", "factor": "0.01", "note": "ISO 80000-1:2009 §6.5.5：% = 0.01（无量纲数）" },
    { "from": "ppm", "to": "dimensionless", "factor": "0.000001", "note": "领域惯例：ppm = 10^-6（质量/质量默认；basis 歧义见 forbidden_mixes）" }
  ],
  "forbidden_mixes": [